{
  "schema_version": "offwork.history-free-run/v1",
  "status": "completed",
  "case_id": "verify",
  "agent": "Codex fresh sub-agent /root/history_free_verify_v3",
  "commands": [
    {
      "purpose": "Produce the exact CLI JSON envelope supplied to the fresh Agent.",
      "argv": [
        "/Users/eddie/Documents/WAIC/offwork/.worktrees/prototype-vertical-slice/bin/offwork",
        "resume",
        "--task",
        "task-b65dcf32b025494f9879f6d4b3b721a5",
        "--capsule",
        "capsule-b20f748607d84c8fa6b2a460f805715f",
        "--project",
        "/Users/eddie/Documents/WAIC/offwork/.worktrees/.offwork-agent-work/2026-08-29-prototype-vertical-slice/history-free/run-20260829T074910Z/verify/project",
        "--json"
      ],
      "elapsed_ms": 239,
      "exit_code": 0
    }
  ],
  "overall_elapsed_ms": 146097,
  "cli_json_envelope": {
    "command": "resume",
    "data": {
      "agent_claimed": {
        "items": [
          "The captured baseline passed its configured check."
        ],
        "source": "capture_context",
        "summary": "The captured baseline passed its automatic check, but migration evidence remains open."
      },
      "auto_checked": {
        "checks": [
          {
            "argv": [
              "/opt/homebrew/opt/python@3.13/bin/python3.13",
              "-c",
              "from pathlib import Path; assert Path('tracked.txt').read_text(encoding='utf-8') == 'captured\\n'"
            ],
            "command": "/opt/homebrew/opt/python@3.13/bin/python3.13 -c 'from pathlib import Path; assert Path('\"'\"'tracked.txt'\"'\"').read_text(encoding='\"'\"'utf-8'\"'\"') == '\"'\"'captured\\n'\"'\"''",
            "cwd": "/Users/eddie/Documents/WAIC/offwork/.worktrees/.offwork-agent-work/2026-08-29-prototype-vertical-slice/history-free/run-20260829T074910Z/verify/project",
            "finished_at": "2026-08-29T07:49:12.158782+00:00",
            "returncode": 0,
            "started_at": "2026-08-29T07:49:12.124658+00:00",
            "status": "passed"
          }
        ],
        "schema_version": "offwork.checks/v1",
        "status": "passed"
      },
      "capsule": {
        "capsule_id": "capsule-b20f748607d84c8fa6b2a460f805715f",
        "captured_at": "2026-08-29T07:49:12.319664+00:00"
      },
      "handoff_verified": {
        "completeness": {
          "missing_information": [],
          "status": "complete"
        },
        "integrity": {
          "status": "passed"
        },
        "restore": {
          "status": "passed"
        }
      },
      "human_acceptance": {
        "acted_at": null,
        "note": null,
        "status": "pending"
      },
      "next_step": "Review the diff for tracked.txt before modifying any project file.",
      "offwork_observed": {
        "branch": "main",
        "changed_paths": [],
        "git_root": "/Users/eddie/Documents/WAIC/offwork/.worktrees/.offwork-agent-work/2026-08-29-prototype-vertical-slice/history-free/run-20260829T074910Z/verify/project",
        "head": "7cd42b4ef945bc7ad4826f4573c46f416787d5f0",
        "project_id": "project-fbf01770dc744935a62c1c21c6a10342",
        "project_path": "/Users/eddie/Documents/WAIC/offwork/.worktrees/.offwork-agent-work/2026-08-29-prototype-vertical-slice/history-free/run-20260829T074910Z/verify/project"
      },
      "open_loops": [
        {
          "disposition": "resolve",
          "note": "Inspect the exact diff before modifying any project file.",
          "title": "Review the post-capture tracked.txt change"
        }
      ],
      "schema_version": "offwork.receipt/v1",
      "task": {
        "captured_revision": 2,
        "current_revision": 2,
        "goal": "Review workspace drift before changing the project again",
        "task_id": "task-b65dcf32b025494f9879f6d4b3b721a5",
        "title": "Verify changed migration work"
      },
      "unknowns": [
        "The changed tracked.txt has not been reviewed against the captured baseline."
      ],
      "workspace_freshness": {
        "changes": [
          "tracked.txt"
        ],
        "checked_at": "2026-08-29T07:49:12.743209+00:00",
        "limitations": [
          "ignored files and external state are not checked"
        ],
        "scope": "explicit_git_project",
        "status": "changed"
      }
    },
    "ok": true,
    "schema_version": "offwork.cli/v1"
  },
  "response": {
    "decision": "verify",
    "cited_receipt_facts": [
      {
        "receipt_path": "$.data.handoff_verified.integrity.status",
        "value": "passed",
        "relevance": "The Capsule passed its integrity check and is trustworthy enough to inspect."
      },
      {
        "receipt_path": "$.data.workspace_freshness.status",
        "value": "changed",
        "relevance": "The workspace changed after capture, so continuation requires verification."
      },
      {
        "receipt_path": "$.data.unknowns",
        "value": [
          "The changed tracked.txt has not been reviewed against the captured baseline."
        ],
        "relevance": "A material Unknown remains about the unreviewed workspace change."
      },
      {
        "receipt_path": "$.data.open_loops",
        "value": [
          {
            "disposition": "resolve",
            "note": "Inspect the exact diff before modifying any project file.",
            "title": "Review the post-capture tracked.txt change"
          }
        ],
        "relevance": "A blocking review loop remains unresolved."
      },
      {
        "receipt_path": "$.data.next_step",
        "value": "Review the diff for tracked.txt before modifying any project file.",
        "relevance": "This supplies the Receipt-grounded first verification action."
      }
    ],
    "proposed_first_action": {
      "mode": "verification",
      "value": "Review the diff for tracked.txt before modifying any project file.",
      "receipt_path": "$.data.next_step",
      "reason": "The workspace is changed and the tracked.txt change remains unreviewed, so the stated diff review is the safe first action."
    }
  },
  "result": "passed",
  "note": "Real history-free Agent run. Exact CLI envelope and Agent response preserved; HEAD, Git index, project files, and human acceptance remained unchanged."
}
